{
  "schema_version": 1,
  "gate": "judge_panel_artifacts_schema",
  "head_sha": "738f5f3adc3e2ef8d53f67093313820d1727cddf",
  "timestamp": "2026-07-03T13:01:47Z",
  "verdict": "PASS",
  "runner": "judge-panel (3x architect generators + evaluator), ADR-037 D5",
  "details": {
    "fork": "artifacts schema: envelope (ADR-012 sketch) vs flat (contract skeleton) + Yjs persistence format/library",
    "approaches": {
      "G1_adr_faithful_envelope": {"correctness": 8, "security": 8, "simplicity": 7, "cost": 7, "perf": 7},
      "G2_flat_version_children": {"correctness": 7, "security": 9, "simplicity": 8, "cost": 8, "perf": 7},
      "G3_evolution_envelope": {"correctness": 6, "security": 8, "simplicity": 7, "cost": 6, "perf": 8}
    },
    "rubric": "lexicographic: correctness > security > simplicity > cost > perf; correctness/security are gates",
    "winner": "G1",
    "winner_rationale": "correctness gate ordered G1(8) > G2(7) > G3(6): G3 broke read-your-writes (async merge could leak missing edits into cited versions); G2 rebound the artifact:// grammar onto two probabilistic ID namespaces and dropped ADR-012 tags/type/'code'",
    "grafts": [
      "G3: current_version_num int (kills circular FK)",
      "G3: s3_objects lifecycle table (also fixes G1 presign key-reservation race via UNIQUE(bucket,s3_key))",
      "G2: composite anti-drift FKs (id, cell_id)",
      "G2: text_export on artifact_versions (future FTS hook, no backfill)",
      "G2: resolver 404 (not 400) on cell mismatch - no existence oracle",
      "G3: storage_kind evolution comment (connector/gitea_ref = CHECK swap)"
    ],
    "recorded_in": ".planning/decisions/ADR-038-artifacts-envelope-schema.md",
    "implementation_verified": "final commit implements the composite; confirmed by the 3-lens adversarial audit (SOUND lens checked ADR-038 fidelity table-by-table)"
  }
}
